{
  "id": "audit-policy",
  "version": "1.0.0",
  "layer": 3,
  "scope": "governance",
  "canonical": true,
  "derives_from": ["execution-lifecycle", "self-healing"],
  "purpose": "Scheduled runtime governance audits to continuously verify runtime health, detect governance drift, and detect integrity violations.",
  "status": "active",
  "rules": [
    {
      "id": "schema-integrity",
      "condition": "governance JSON artifact does not validate against its declared schema",
      "action": "report_with_severity_score_and_remediation",
      "severity": "CRITICAL",
      "description": "All canonical JSON artifacts must validate against their schemas."
    },
    {
      "id": "dependency-integrity",
      "condition": "ticket or milestone dependency references non-existent entity or creates cycle",
      "action": "report_with_severity_score_and_remediation",
      "severity": "HIGH",
      "description": "Dependency graph must be acyclic and fully resolved."
    },
    {
      "id": "milestone-consistency",
      "condition": "milestone has invalid status, missing tickets, or orphaned references",
      "action": "report_with_severity_score_and_remediation",
      "severity": "HIGH",
      "description": "Milestone definitions must be internally consistent."
    },
    {
      "id": "runtime-continuity",
      "condition": "runtime state file is malformed, execution state diverges from history, or heartbeat is stale",
      "action": "report_with_severity_score_and_remediation",
      "severity": "CRITICAL",
      "description": "Runtime state must be continuous and consistent."
    },
    {
      "id": "projection-validity",
      "condition": "markdown reflection is stale or missing relative to canonical JSON source",
      "action": "report_with_severity_score_and_remediation",
      "severity": "MEDIUM",
      "description": "Projections must accurately reflect canonical state."
    },
    {
      "id": "event-consistency",
      "condition": "event stream has gaps, duplicates, or out-of-order timestamps",
      "action": "report_with_severity_score_and_remediation",
      "severity": "MEDIUM",
      "description": "Event streams must be append-only and monotonic."
    }
  ],
  "invariants": [
    {
      "id": "deterministic-audit",
      "expression": "same runtime state always produces identical audit score and findings",
      "severity": "HIGH",
      "description": "Audit results must be reproducible."
    },
    {
      "id": "severity-score-range",
      "expression": "severity score is always an integer between 0 and 100 inclusive",
      "severity": "HIGH",
      "description": "Severity score must be bounded and deterministic."
    },
    {
      "id": "human-readable-reports",
      "expression": "every audit produces both machine-readable JSON and human-readable Markdown report",
      "severity": "MEDIUM",
      "description": "Reports must be accessible to both systems and humans."
    }
  ],
  "triggers": [
    {
      "id": "scheduled-audit",
      "category": "optional",
      "condition": "every 60 minutes during active sessions",
      "throttle": { "max_per_minute": 1, "cooldown_seconds": 3600 },
      "description": "Periodic runtime audit"
    },
    {
      "id": "post-milestone-audit",
      "category": "mandatory",
      "condition": "after every milestone status change to completed",
      "description": "Validate milestone completion integrity"
    }
  ],
  "metadata": {
    "created_at": "2026-05-20T01:50:00Z",
    "updated_at": "2026-05-20T01:50:00Z"
  }
}
